"set_id","question_number","question_text","correct_answer","wrong_answer_1","wrong_answer_2","wrong_answer_3","category","quiz_type","difficulty","explanation","improvement_note"
"ear-rhythm-004","335","What is 'simple meter'?","Meter where each beat divides into 2 (e.g., 2/4, 3/4, 4/4)","Meter with no subdivisions","Meter where beats divide into 3","Meter with an odd number of beats","Rhythm","ear_training_text","beginner","Simple meter: beats subdivide into 2 equal parts. 4/4 = 4 beats, each splits into 2 eighth notes.","Simple meter: 2, 3, or 4 beats per measure, dividing into 2."
"ear-rhythm-005","336","What is 'compound meter'?","Meter where each beat divides into 3 (e.g., 6/8, 9/8, 12/8)","Simple meter with 3 beats","Irregular time signatures","Meter with very fast tempo","Rhythm","ear_training_text","intermediate","Compound meter: beats subdivide into 3 equal parts. 6/8 = 2 dotted-quarter beats, each dividing into 3.","6/8 FEELS like 2 beats (both dotted quarters). Each beat subdivides into 3 eighth notes."
"ear-rhythm-006","337","In 6/8 time, how many main beats does the listener feel?","2 (two dotted quarter note beats)","6 (six eighth note beats)","3","4","Rhythm","ear_training_text","intermediate","6/8 is typically felt in 2 large beats (each = 3 eighth notes = dotted quarter). Fast 6/8 feels like a quick 2.","Slow 6/8 can sound like 6; fast 6/8 sounds like 2. Conducting = 2 beats."
"ear-rhythm-007","338","What is 'syncopation'?","Emphasis on weak beats or the 'and' between beats (off-beat accents)","Playing only on the beat","Skipping beats randomly","Accents on beat 1 only","Rhythm","ear_training_text","intermediate","Syncopation: rhythmic accent placed on normally weak beats or between beats. Core to jazz, funk, and reggae.","'The and' of beat 2 or 4 is classic syncopation: 'one AND two AND three AND four AND'."
"ear-rhythm-008","339","What is 'swing' rhythm?","Eighth notes played as triplet-feel pairs (long-short pattern)","Straight eighth notes","A type of meter","Music with 3/4 time signature","Rhythm","ear_training_text","intermediate","Swing feel: eighth notes are not equal. The first is slightly longer (as if a dotted note) and the second shorter.","Written as two equal eighths, played as triplet long-short: the essence of jazz rhythm."
"ear-rhythm-009","340","What is the difference between 'swing' and 'straight' eighth notes?","Swing = long-short triplet feel; Straight = equal eighth notes","They are played identically","Swing is slower; straight is faster","Swing only appears in jazz; straight only in classical","Rhythm","ear_training_text","intermediate","Straight eighths: equal duration. Swing eighths: the first is held slightly longer (2/3 of a beat) and the second is shorter (1/3).","Most jazz is swung; most pop/rock is straight. 'Shuffle' = very pronounced swing feel."
"ear-rhythm-010","341","What is a 'triplet'?","Three equal notes played in the time of two","Two notes in the time of three","Four notes in the time of three","Three notes each lasting 2 beats","Rhythm","ear_training_text","beginner","Triplet: three notes equally dividing what would normally be two notes. Marked with a '3'.","Quarter note triplet: 3 notes in 2 beats. Eighth note triplet: 3 notes in 1 beat."
"ear-rhythm-011","342","What is 'hemiola'?","A rhythmic shift where 3 groups of 2 and 2 groups of 3 conflict (3:2 ratio)","A type of triplet","A rhythm in 6/8 only","A syncopated pattern","Rhythm","ear_training_text","advanced","Hemiola: e.g., in 3/4, accenting every 2 beats creates a sense of 2 against the 3 beat meter.","Brahms used hemiola constantly. Classic example: Bernstein's 'America' from West Side Story."
"ear-rhythm-012","343","What is 'polyrhythm'?","Two or more different rhythmic patterns played simultaneously (e.g., 3 against 2)","Multiple melodies at once","Playing in two time signatures in sequence","Syncopation in two hands","Rhythm","ear_training_text","advanced","Polyrhythm: e.g., right hand plays 3 beats while left hand plays 2 (3:2 polyrhythm). Common in African and jazz music.","'3 against 2' exercise: one hand plays triplets while other plays duplets."
"ear-rhythm-013","344","What is 'polymeter'?","Different instruments playing in different meters simultaneously","Multiple time signatures written in a score","A piece that changes time signature","A fast rhythmic passage","Rhythm","ear_training_text","advanced","Polymeter: two or more instruments playing in different meters simultaneously (e.g., one in 4/4, another in 3/4).","The Steve Reich composition 'Clapping Music' explores polymetric relationships."
"ear-rhythm-014","345","What is 'cross-rhythm'?","A rhythm that creates the feeling of a different meter than written (e.g., 3+3+2 in 4/4)","Mixing two rhythms alternately","A rhythm that conflicts with the melody","Any unusual rhythm","Rhythm","ear_training_text","advanced","Cross-rhythm: accenting notes in a pattern that creates a contrasting meter (e.g., 3+3+2 in 8/8 = 'Brazilian' feel).","'3-3-2' clave and African 'son clave' patterns are cross-rhythms."
"ear-rhythm-015","346","What is the 'clave' rhythm?","A foundational 2-bar rhythmic pattern in Afro-Cuban music (e.g., 3-2 or 2-3 son clave)","A one-bar repeating pattern","The downbeat of Latin music","A type of syncopation only","Rhythm","ear_training_text","advanced","Clave: the foundational ostinato pattern of Afro-Cuban music. Son clave: 3-2 = three hits in bar 1, two in bar 2.","Everything in Cuban music is organized in relation to the clave pattern."
"ear-rhythm-016","347","What note value gets 1 beat in 4/4 time?","Quarter note","Half note","Eighth note","Whole note","Rhythm","ear_training_text","beginner","In 4/4: quarter note = 1 beat. The '4' in 4/4 means the quarter note gets the beat.","The bottom number of the time signature shows which note value = 1 beat."
"ear-rhythm-017","348","What note value gets 1 beat in 6/8 time?","Dotted quarter note (= 3 eighth notes)","Quarter note","Eighth note","Half note","Rhythm","ear_training_text","intermediate","In 6/8: the dotted quarter = 1 beat (containing 3 eighth notes).","Bottom number 8 means eighth note gets the sub-beat; groups of 3 eighths = 1 dotted quarter beat."
"ear-rhythm-018","349","What note value gets 1 beat in 3/8 time?","Eighth note","Quarter note","Dotted quarter","Half note","Rhythm","ear_training_text","intermediate","In 3/8: bottom '8' = eighth note gets the beat. 3 eighth note beats per measure.","Simpler 3/8 = 3 eighth beats. Contrast with 3/4 = 3 quarter beats."
"ear-rhythm-019","350","What does a dot after a note do?","Adds half the original note's value to it","Doubles the note's value","Removes a beat from the note","Makes the note staccato","Rhythm","ear_training_text","beginner","Dotted note: original + half = 1.5× the original value. Dotted quarter = 1.5 beats (quarter + eighth).","Dot = add 50% of original value."
"ear-rhythm-020","351","What does a double dot after a note do?","Adds 3/4 of the original value (original + 1/2 + 1/4)","Triples the value","Same as a single dot","Doubles the note","Rhythm","ear_training_text","advanced","Double dot: original + half + quarter = 1.75× original. Double-dotted quarter = 1.75 beats.","Less common but found in Baroque and Romantic music."
"ear-rhythm-021","352","What is a 'tie' vs a 'slur'?","Tie connects same-pitch notes (held); slur connects different notes (played smoothly)","They are identical symbols","Tie = legato; slur = staccato","Tie is for piano; slur for strings","Rhythm","ear_training_text","beginner","Tie: curved line connecting two notes of the same pitch — the second is not re-articulated. Slur: smooth connection across different pitches.","Both look similar but have different functions."
"ear-rhythm-022","353","What is a 'tuplet'?","A note group that divides a beat into more or fewer parts than normal (e.g., triplet, quintuplet)","Any group of notes","Notes tied together","A note with a dot","Rhythm","ear_training_text","intermediate","Tuplet = any irregular note grouping: triplets (3), quintuplets (5), sextuplets (6), septuplets (7).","Triplets are the most common tuplet; others appear in more complex music."
"ear-rhythm-023","354","What is 'isorhythm'?","A technique where a rhythmic pattern (talea) repeats independently from the pitch pattern (color)","A rhythm in equal time values","Rhythm that matches the melody exactly","A single repeating rhythm","Rhythm","ear_training_text","advanced","Isorhythm: medieval/Renaissance technique with a repeating rhythmic pattern and a separate repeating pitch pattern that don't line up.","Machaut used isorhythm in his motets. Also heard in minimalist music."
"ear-rhythm-024","355","What is 'augmentation' of a rhythm?","Doubling the note values (slowing the rhythm)","Speeding up a rhythm","Adding notes to a rhythm","Playing a rhythm louder","Rhythm","ear_training_text","advanced","Augmentation: increase all note values proportionally (e.g., eighth notes become quarter notes). The rhythm sounds in 'slow motion.'","Diminution = halving the note values (speeding up). Both are classical compositional devices."
"ear-rhythm-025","356","What is 'diminution' of a rhythm?","Halving the note values (speeding up the rhythm)","Slowing a rhythm down","Reducing the number of notes","Making notes quieter","Rhythm","ear_training_text","advanced","Diminution: reduce note values proportionally. Eighth notes become sixteenths — the rhythm sounds twice as fast.","Often used in fugues: subject appears in augmentation then diminution."
"ear-rhythm-026","357","What is 'groove' in music?","The feeling of rhythmic momentum and 'lock' between musicians","A specific beat pattern","A repeated melody","A bass line pattern only","Rhythm","ear_training_text","intermediate","Groove = the collective rhythmic feel when musicians align their timing, creating a forward momentum that makes you want to move.","'In the pocket' = playing with a deep groove, perfectly aligned with the beat."
"ear-rhythm-027","358","What does 'playing in the pocket' mean?","Locking in rhythmically with the other musicians, slightly behind or exactly on the beat","Playing solos only","Playing slightly ahead of the beat","Playing very loudly","Rhythm","ear_training_text","intermediate","'In the pocket': a drummer or bassist places notes consistently in perfect rhythmic alignment, creating a solid groove.","Questlove (The Roots) and James Brown's JBs are famous for playing 'in the pocket.'"
"ear-rhythm-028","359","What is 'rushing'?","Playing ahead of the beat (too fast in time)","Playing behind the beat","Playing loudly","Skipping notes","Rhythm","ear_training_text","beginner","Rushing = playing slightly ahead of the beat. Common beginner mistake. A metronome reveals rushing immediately.","Practice with a metronome to develop steady timing. Record yourself to hear rushing."
"ear-rhythm-029","360","What is 'dragging'?","Playing behind the beat (too slow in time)","Playing ahead of the beat","Playing too softly","Holding notes too long","Rhythm","ear_training_text","beginner","Dragging = playing slightly behind the beat. Some styles intentionally play 'behind the beat' for a relaxed feel.","R&B singers and blues players often intentionally drag notes for expressive effect."
"ear-rhythm-030","361","What is 'rubato'?","Flexible, expressive timing where the tempo freely slows and quickens","A type of time signature","Very fast tempo","Playing without a metronome","Rhythm","ear_training_text","intermediate","Rubato ('robbed time'): freely bending the tempo for expressive purposes. Common in Chopin and Romantic music.","'Stealing' time from one note and giving it back to another."
"ear-rhythm-031","362","What is a 'fermata'?","A symbol that tells performers to hold a note longer than its written value","A rest symbol","A time signature","A dynamic marking","Rhythm","ear_training_text","beginner","Fermata (bird's eye): hold the note until the conductor or performer decides to release. Duration is subjective.","Found at cadence points and emotionally important moments."
"ear-rhythm-032","363","What is 'ritardando' (rit.)?","Gradually slowing down the tempo","Suddenly stopping","Speeding up gradually","Returning to original tempo","Rhythm","ear_training_text","beginner","Ritardando (or rallentando): gradually decelerate the tempo. Common at phrase endings and before a fermata.","Ritard. = gradual slow; A tempo = return to original speed."
"ear-rhythm-033","364","What is 'accelerando' (accel.)?","Gradually speeding up the tempo","Suddenly fast","Gradual slowing","Holding a note longer","Rhythm","ear_training_text","beginner","Accelerando: the tempo gradually increases. Creates excitement and forward momentum.","Contrasts with ritardando (gradual slowing)."
"ear-rhythm-034","365","What is 'asymmetric meter'?","A time signature with an odd number of beats that can't divide evenly (e.g., 5/4, 7/8)","Any meter with unusual grouping","A meter that changes every bar","A slow compound meter","Rhythm","ear_training_text","intermediate","Asymmetric meter: 5/4, 7/8, 11/8 etc. Beats group in unequal patterns (e.g., 2+3 or 3+2+2).","Dave Brubeck's 'Take Five' (5/4) and 'Unsquare Dance' (7/8) are iconic asymmetric meter examples."
"ear-rhythm-035","366","How does 5/4 time feel?","Uneven; typically grouped as 3+2 or 2+3 beats","Exactly like 4/4 with an extra beat","Completely unstable and random","Like 6/8 but faster","Rhythm","ear_training_text","intermediate","5/4 = 5 quarter note beats. Grouping determines feel: 3+2 (strong-weak-weak-strong-weak) or 2+3.","'Take Five': 2+3 feel. Pink Floyd's 'Money' intro: 7/8 = 2+2+3."
"ear-rhythm-036","367","What time signature is used in most marches?","2/4 (two quarter note beats per bar — 'left-RIGHT')","4/4","3/4","6/8","Rhythm","ear_training_text","beginner","Marches use 2/4: strong beat 1 (left foot), weak beat 2 (right foot). Energetic and forward-moving.","'Stars and Stripes Forever', 'Entry of the Gladiators' = 2/4 march time."
"ear-rhythm-037","368","What time signature characterizes waltz music?","3/4 (three quarter note beats: STRONG-weak-weak)","4/4","6/8","2/4","Rhythm","ear_training_text","beginner","Waltz = 3/4: strong beat 1, weaker beats 2 and 3. The 'oom-pah-pah' feel.","Strauss waltzes, 'My Favorite Things', Chopin's Waltzes — all in 3/4."
"ear-rhythm-038","369","What is the difference between 3/4 and 3/8?","3/4 = quarter note beats (slower, fuller); 3/8 = eighth note beats (faster, lighter)","They are identical","3/8 is simply faster than 3/4","3/4 has more notes","Rhythm","ear_training_text","intermediate","3/4: each beat = quarter note (more spacious). 3/8: each beat = eighth note (lighter, often faster).","Schubert's Ländler and Minuets often use 3/8 for a lighter dance feel."
"ear-rhythm-039","370","What is 'cut time' (alla breve)?","2/2 time: half note = 1 beat, 2 beats per measure (feels twice as fast as 4/4)","4/4 played twice as fast","A time signature for strings only","Common time with a cut through it for decoration","Rhythm","ear_training_text","intermediate","Cut time (₵): half note gets the beat. 2 half-note beats per measure. Makes fast music look cleaner on paper.","Choral music and marches often use cut time for fast passages."
"ear-rhythm-040","371","What is 'common time'?","4/4 time, indicated by the letter C","The most used time signature","Any simple meter","A time signature without numbers","Rhythm","ear_training_text","beginner","Common time = 4/4. The C symbol is a historical remnant from mensural notation, NOT an abbreviation of 'common.'","4/4 is called 'common time' because it's by far the most frequently used in Western music."
"ear-rhythm-041","372","What is a 'downbeat'?","The first (and strongest) beat of a measure","Any beat in the measure","The last beat","A beat played very softly","Rhythm","ear_training_text","beginner","Downbeat = beat 1 of any measure. The strongest, most emphasized beat. Named from the conductor's downward baton motion.","The start of each bar is a downbeat."
"ear-rhythm-042","373","What is an 'upbeat' or 'anacrusis'?","A note or notes before the first full measure (pickup beat)","The last beat of any measure","Beat 4 in 4/4 time","A beat played softly","Rhythm","ear_training_text","intermediate","Upbeat/anacrusis: one or more notes before the first downbeat. E.g., 'Happy Birthday' starts with an upbeat ('Hap-').","Many folk songs, anthems, and themes begin with an upbeat."
"ear-rhythm-043","374","What is 'off-beat'?","Notes falling between main beats (on the 'ands')","Any note not on beat 1","A syncopated note only","Notes in a rest position","Rhythm","ear_training_text","intermediate","Off-beat: eighth notes on the 'and' between quarter note beats. E.g., 'one-AND-two-AND.' The AND = off-beat.","Reggae music emphasizes the off-beat (beat 2 and 4 off-beat strumming)."
"ear-rhythm-044","375","What is 'backbeat'?","Emphasis on beats 2 and 4 in 4/4 time (snare drum pattern in rock)","Beat 1 emphasis","A jazz rhythm","Playing behind the beat (dragging)","Rhythm","ear_training_text","intermediate","Backbeat: in rock and pop, the snare drum on beats 2 and 4 creates the 'backbeat' — the characteristic rock feel.","Without backbeat, rock music loses its groove. Clapping on 2 and 4 at concerts = backbeat."
"ear-rhythm-045","376","What is 'swing feel' in jazz and blues?","Eighth notes played as long-short (triplet feel): the beat swings forward","Equal eighth notes","A type of time signature","A rhythm used only in 3/4","Rhythm","ear_training_text","intermediate","Jazz swing: notated equal eighths are played unequally — the first is ~2/3 of a beat, the second ~1/3.","'Swing notation' is often written in the score header."
"ear-rhythm-046","377","What is a 'shuffle' rhythm?","A very pronounced swing feel with eighth note triplets (long-short pattern)","A straight eighth pattern","A syncopated beat 2 pattern","A pattern in 6/8","Rhythm","ear_training_text","intermediate","Shuffle: triplet-based rhythm where you play 1st and 3rd triplet of each beat. Creates a 'loping' feel.","Chicago blues, many B.B. King songs use shuffle rhythm."
"ear-rhythm-047","378","What is the 'Habanera' rhythm?","A dotted eighth + sixteenth + two eighths pattern used in Cuban/tango music","A 6/8 pattern","A jazz swing pattern","A waltz variation","Rhythm","ear_training_text","advanced","Habanera rhythm: dotted eighth - sixteenth - eighth - eighth (or two quarters). Found in Bizet's 'Carmen' and tango.","The Habanera became the basis for tango and influenced jazz (New Orleans connection to Cuba)."
"ear-rhythm-048","379","What is 'songo'?","A Cuban rhythm style blending son clave with American funk/jazz drumming","A simple African rhythm","A Brazilian samba pattern","A type of swing feel","Rhythm","ear_training_text","advanced","Songo: developed by Los Van Van in the 1970s. Mixes Cuban clave with jazz and funk drumming innovations.","Songo broke the strict clave rule, allowing freer rhythmic interaction."
"ear-rhythm-049","380","What is 'bomba'?","A Puerto Rican Afro-Caribbean rhythm featuring call-and-response between dancer and drummer","A Cuban rhythm","A Brazilian pattern","A jazz feel","Rhythm","ear_training_text","advanced","Bomba: Puerto Rican tradition. The lead drummer (repicador) follows and responds to the dancer's movements.","Unique in that the drummer follows the dancer, not vice versa."
"ear-rhythm-050","381","What is 'son clave'?","A 3-2 or 2-3 repeating 2-bar pattern that organizes Afro-Cuban music","A single bar rhythm","A Brazilian 7-beat pattern","A jazz triplet pattern","Rhythm","ear_training_text","advanced","Son clave: 3-2 = three strokes in bar 1, two in bar 2. 2-3 = the reverse. Everything in Cuban music relates to the clave.","Clave is the DNA of Afro-Cuban music."
"ear-rhythm-051","382","What is 'samba' rhythm characterized by?","Syncopated 16th-note patterns with emphasis on beat 2 in 2/4","Simple waltz feel in 3/4","Shuffle feel in 4/4","Straight 8th notes in 6/8","Rhythm","ear_training_text","advanced","Samba: fast 2/4 with highly syncopated 16th-note patterns. The 'and-of-1' and 'and-of-2' are emphasized.","Brazilian samba is the heartbeat of Carnival. Bateria (drum corps) of up to 300 drummers."
"ear-rhythm-052","383","What is 'bossa nova' rhythm?","A softer, jazzier samba feel with the João Gilberto guitar pattern","Fast samba only","A slow waltz feel","A jazz swing feel","Rhythm","ear_training_text","advanced","Bossa nova (1950s Brazil): samba rhythm softened with jazz harmony. The guitar plays a syncopated chord pattern.","'Girl from Ipanema' (Jobim), 'Garota de Ipanema' = iconic bossa nova."
"ear-rhythm-053","384","What is 'Afrobeat'?","Fela Kuti's fusion of West African highlife, funk, and jazz with complex polyrhythmic feel","Simple African drumming","A type of hip-hop","Straight 4/4 African pop","Rhythm","ear_training_text","advanced","Afrobeat: Fela Kuti's genre combining West African rhythms, American funk, jazz harmonies, and political lyrics.","Fela Kuti is the 'King of Afrobeat.' Influence heard in many modern pop and funk styles."
"ear-rhythm-054","385","What is 'rhythmic dictation'?","Transcribing a rhythm heard by writing down its note values","Performing a written rhythm","Identifying the time signature only","Clapping along to music","Rhythm","ear_training_text","intermediate","Rhythmic dictation: listen to a rhythm and write it down accurately with correct note values.","Start with simple patterns; gradually increase complexity."
"ear-rhythm-055","386","What is the most effective way to internalize rhythm?","Clapping, singing, or moving to the rhythm while subdividing the beat","Reading rhythms silently","Listening to recordings only","Counting only in your head","Rhythm","ear_training_text","beginner","Embodied practice: physically clap, tap, or move while verbally counting. The body internalizes rhythm better than the mind alone.","'Body percussion' (clapping, stomping) is used in Orff music education."
"ear-rhythm-056","387","What does 'subdividing the beat' mean in rhythm practice?","Feeling each beat divided into 2 or 4 smaller equal parts (eighth or sixteenth notes)","Playing twice as fast","Adding extra notes","Counting beats in groups","Rhythm","ear_training_text","beginner","Subdivision: internally feel each beat split into 2 (eighth notes) or 4 (16ths). Keeps timing accurate for syncopation.","When playing syncopated rhythms, subdividing prevents rushing or dragging."
"ear-rhythm-057","388","What is a 'metric modulation'?","A tempo change where a new tempo is related to a subdivision of the old tempo (e.g., eighth note becomes new quarter note)","Simply changing the time signature","Slowing down gradually","A sudden change to 3/4","Rhythm","ear_training_text","advanced","Metric modulation: the new BPM is mathematically derived from a subdivision of the old tempo. Elliott Carter pioneered this.","E.g., in 4/4 at 60 BPM, if the triplet eighth = new quarter note, new tempo = 90 BPM."
"ear-rhythm-058","389","What is 'additive rhythm'?","Rhythm built by adding units of 2s and 3s (e.g., 2+2+3+2 = 9/8)","Rhythm that gets progressively louder","Combining two different rhythms","Playing the same rhythm on different instruments","Rhythm","ear_training_text","advanced","Additive rhythm: constructing measures by combining groups of 2 and 3 (rather than dividing a large meter).","Common in Balkan music: 7/8 = 2+2+3 or 3+2+2. Bartók used additive rhythm extensively."
"ear-rhythm-059","390","What is 'Aksak rhythm'?","Irregular (limping) rhythms common in Balkan and Turkish folk music (asymmetric groupings)","A fast waltz","A slow blues pattern","A type of syncopation","Rhythm","ear_training_text","advanced","Aksak ('limping' in Turkish): asymmetric patterns like 2+2+2+3 in 9/8 = Bulgarian folk rhythm.","These rhythms feel 'uneven' to Western ears but groove naturally in their cultural context."
"ear-rhythm-060","391","What is 'minimalist rhythmic technique'?","Repeating short rhythmic cells with gradual phase shifts or additions (Steve Reich, Glass)","Using only one rhythm throughout","A rhythm with minimum notes","A very simple 4/4 pattern","Rhythm","ear_training_text","advanced","Minimalism: slowly evolving patterns, phase shifting (Reich's 'Phasing'), and rhythmic addition/subtraction.","Steve Reich's 'Drumming' and 'Music for 18 Musicians' are landmark minimalist works."
"ear-rhythm-061","392","What is 'Steve Reich's phasing technique'?","Two performers play the same pattern but gradually go out of phase with each other","Two musicians speeding up together","A polyrhythmic technique","A type of jazz improvisation","Rhythm","ear_training_text","advanced","Phasing: start in unison, then one performer very gradually increases tempo. Creates shimmering rhythmic patterns.","'Piano Phase' and 'Violin Phase' are Reich's early phasing works (1967)."
"ear-rhythm-062","393","How does ear training for rhythm differ from pitch ear training?","Rhythm training focuses on duration, pulse, and relative timing; pitch on frequency and quality","They are identical","Rhythm is easier to train","Pitch training is always done first","Rhythm","ear_training_text","beginner","Rhythmic ear training: internalizing pulse, note durations, meter, syncopation. Pitch training: intervals, chords, scales.","Both are equally important. Many students develop pitch ear faster than rhythmic ear."
"ear-rhythm-063","394","What is 'call and response' in rhythm?","A pattern where one phrase is 'asked' by one voice and 'answered' by another","A repeated rhythm only","A 4-bar pattern","A type of syncopation","Rhythm","ear_training_text","beginner","Call and response: common in African, gospel, blues, and jazz music. A rhythmic/melodic idea is presented and answered.","Blues lyrics, jazz solos, and gospel singing are built on call-and-response."
